{
  "timestamp": "2026-09-14T00:00:00Z",
  "records_audited": 1000,
  "record_type": "REFERENCE",
  "direct_identifiers_found": 0,
  "direct_identifiers_removed": true,
  "privacy_violations": [],
  "de_identification_verified": true,
  "full_anonymization_guarantee": "NOT_CLAIMED",
  "anonymization_notes": "Direct identifiers (names, SSN, phone, email, address, MRN) were verified absent. Complete k-anonymity is not claimed because clinical quasi-identifiers (age, sex, cancer type, stage) are preserved for oncology statistical prior modeling.",
  "privacy_status": "PASS"
}